{
  "gate_id": "E1",
  "outcome": "pass",
  "decided_at": "2026-07-31T17:22:40Z",
  "decided_by": {
    "role": "reviewer",
    "identity": "grok/grok-5"
  },
  "producer_identity": "claude-code/sonnet-5",
  "separation_level": "separate_provider",
  "separation_caveat": false,
  "inputs": [
    {
      "artifact_id": "search_protocol",
      "content_hash": "sha256:3bd95cf6d36d991cac782a008c6e213da05c50a72e6ce5d9cb925e722ae2cc8e"
    },
    {
      "artifact_id": "corpus_snapshot",
      "content_hash": "sha256:84d3a4c3d68324ce36ce4af47cc34efde4e45d0ef280d67a99682c19a5f2cc10"
    },
    {
      "artifact_id": "kg_snapshot",
      "content_hash": "sha256:06cf12e59c233f528bba507bfe9a63b2d6a9c00e83f4844b8a3acc46620e9d2e"
    },
    {
      "artifact_id": "evidence_matrix",
      "content_hash": "sha256:aba7f1d3513f1abb94dd7a0072fb3cae8dc8cf2a306e1a922119f2a05b7a6a90"
    }
  ],
  "checks": [
    {
      "name": "presence",
      "status": "PASS",
      "detail": "4 inputs present"
    },
    {
      "name": "schema",
      "status": "PASS",
      "detail": "all inputs validate"
    },
    {
      "name": "provenance",
      "status": "PASS",
      "detail": "input hashes match"
    },
    {
      "name": "staleness",
      "status": "PASS",
      "detail": "no upstream artifact changed"
    },
    {
      "name": "separation",
      "status": "PASS",
      "detail": "SEPARATE PROVIDER"
    },
    {
      "name": "budget",
      "status": "PASS",
      "detail": "3 of 3 attempts remain"
    },
    {
      "name": "source_support",
      "status": "PASS",
      "detail": "clean"
    }
  ],
  "reason": null,
  "findings": [],
  "revision_budget": {
    "max": 3,
    "used": 0
  }
}
