{
  "gate_id": "T1",
  "outcome": "pass",
  "decided_at": "2026-07-31T17:22:41Z",
  "decided_by": {
    "role": "reviewer",
    "identity": "grok/grok-5"
  },
  "producer_identity": "claude-code/opus-5",
  "separation_level": "separate_provider",
  "separation_caveat": false,
  "inputs": [
    {
      "artifact_id": "design_protocol",
      "content_hash": "sha256:d90be19c1dcf4be9c04cd4e5dd33f22670270f1a4db89e764e09a83e61f8c0f9"
    },
    {
      "artifact_id": "hypothesis_registry",
      "content_hash": "sha256:dfe5c32218dd9f3fd584723d1783468c7820871cad9847a7e813ffc39292cce6"
    },
    {
      "artifact_id": "evidence_matrix",
      "content_hash": "sha256:aba7f1d3513f1abb94dd7a0072fb3cae8dc8cf2a306e1a922119f2a05b7a6a90"
    }
  ],
  "checks": [
    {
      "name": "presence",
      "status": "PASS",
      "detail": "3 inputs present"
    },
    {
      "name": "schema",
      "status": "PASS",
      "detail": "all inputs validate"
    },
    {
      "name": "provenance",
      "status": "PASS",
      "detail": "input hashes match"
    },
    {
      "name": "staleness",
      "status": "PASS",
      "detail": "no upstream artifact changed"
    },
    {
      "name": "separation",
      "status": "PASS",
      "detail": "SEPARATE PROVIDER"
    },
    {
      "name": "budget",
      "status": "PASS",
      "detail": "3 of 3 attempts remain"
    },
    {
      "name": "design_traceability",
      "status": "PASS",
      "detail": "clean"
    }
  ],
  "reason": null,
  "findings": [],
  "revision_budget": {
    "max": 3,
    "used": 0
  }
}
