{
  "gate_id": "T2",
  "outcome": "pass",
  "decided_at": "2026-07-31T17:22:41Z",
  "decided_by": {
    "role": "reviewer",
    "identity": "codex/gpt-5.6"
  },
  "producer_identity": "claude-code/sonnet-5",
  "separation_level": "separate_provider",
  "separation_caveat": false,
  "inputs": [
    {
      "artifact_id": "code_commit",
      "content_hash": "sha256:7d5f12e761b9255d33d0abb8adb9b3abc2cf593f8f092ad8aa3573fc3a75dcc3"
    },
    {
      "artifact_id": "environment_lock",
      "content_hash": "sha256:d3613723e6a1c07adfb605601058d74ea074e325e58c32d53ac7ccd255c0d4f5"
    },
    {
      "artifact_id": "data_manifest",
      "content_hash": "sha256:e9c56c7700b51710ce4e0531a274eb3569d5aa2987f85b65481a5e862e8031c1"
    },
    {
      "artifact_id": "run_manifest",
      "content_hash": "sha256:78c1cefbe4d2410f00b72a991f55ab0b2d1189a164e2693a70d000971feb6d0b"
    },
    {
      "artifact_id": "raw_results",
      "content_hash": "sha256:8e9e0771dea0a422d890ce451a83e73692e37aabcc70242688d509cefbe0d314"
    }
  ],
  "checks": [
    {
      "name": "presence",
      "status": "PASS",
      "detail": "5 inputs present"
    },
    {
      "name": "schema",
      "status": "PASS",
      "detail": "all inputs validate"
    },
    {
      "name": "provenance",
      "status": "PASS",
      "detail": "input hashes match"
    },
    {
      "name": "staleness",
      "status": "PASS",
      "detail": "no upstream artifact changed"
    },
    {
      "name": "separation",
      "status": "PASS",
      "detail": "SEPARATE PROVIDER"
    },
    {
      "name": "budget",
      "status": "PASS",
      "detail": "3 of 3 attempts remain"
    },
    {
      "name": "run_integrity",
      "status": "PASS",
      "detail": "clean"
    }
  ],
  "reason": null,
  "findings": [],
  "revision_budget": {
    "max": 3,
    "used": 0
  }
}
